{
  "schema": "ucc.credential-lease",
  "schema_version": 1,
  "id": "cred_01K0A6R4V8W6E3M4M8Y0R9J2QC",
  "created_at": "2026-08-22T12:00:00.000Z",
  "created_by": "act_01K0A6R4V8W6E3M4M8Y0R9J2QA",
  "record_version": 1,
  "node_id": "node_01K0A6R4V8W6E3M4M8Y0R9J2QX",
  "credential_ref": "git:deploy-key:repo-1",
  "lease_phase": "active",
  "target_path": "credentials/deploy.key",
  "scope": "repo:read",
  "leased_at": "2026-08-22T12:00:00.000Z",
  "expires_at": "2026-08-22T13:00:00.000Z"
}
